{
  "hard_download_cap_bytes": 1073741824,
  "registry_version": "darkmind-v2-phase1a-example",
  "reviewed_at": "2026-07-04",
  "sources": [
    {
      "approval_reason": "Official Wikimedia dump chunk with published license terms and checksum files; sample is capped below the Phase 1A download limit.",
      "approved": true,
      "attribution_requirements": "Preserve article-level attribution through Wikimedia page or history links in manifests and reports.",
      "checksum_available": true,
      "checksum_url": "https://dumps.wikimedia.org/trwiki/latest/trwiki-latest-md5sums.txt",
      "commercial_use_status": "allowed_with_license_compliance",
      "content_type": "encyclopedic_articles",
      "documented_retrieval_method": "Use one official Turkish Wikipedia pages-articles split chunk from https://dumps.wikimedia.org/trwiki/latest/ and verify the matching checksum before sampling.",
      "estimated_download_size": "about 357 MB for the selected split chunk",
      "estimated_download_size_bytes": 374341632,
      "evidence_urls": [
        "https://dumps.wikimedia.org/trwiki/latest/",
        "https://foundation.wikimedia.org/wiki/Policy:Terms_of_Use"
      ],
      "intended_sample_size_characters": 18000000,
      "jurisdiction_warning": "Reuse must comply with CC BY-SA 4.0/GFDL attribution and share-alike requirements.",
      "language": "tr",
      "license_id": "CC-BY-SA-4.0-and-GFDL",
      "max_download_bytes": 1073741824,
      "max_sample_characters": 20000000,
      "modification_status": "allowed_with_license_compliance",
      "notes": "Prefer current articles only; remove markup, tables, templates, user pages, and non-article namespaces before tokenizer use.",
      "official_domains": [
        "tr.wikipedia.org",
        "wikipedia.org",
        "wikimedia.org",
        "dumps.wikimedia.org",
        "foundation.wikimedia.org"
      ],
      "official_download_url": "https://dumps.wikimedia.org/trwiki/latest/trwiki-latest-pages-articles1.xml-p1p1500000.bz2",
      "official_homepage": "https://tr.wikipedia.org/",
      "official_license_url": "https://foundation.wikimedia.org/wiki/Policy:Terms_of_Use",
      "redistribution_requirements": "Redistribution must preserve license notices and share-alike obligations for modified text.",
      "retrieval_method": "chunked_download",
      "risk_level": "medium",
      "snapshot_date": "2026-07-04",
      "source_id": "wikimedia_trwiki_articles_split",
      "source_name": "Turkish Wikipedia pages-articles official dump split",
      "source_version": "trwiki latest snapshot reviewed on 2026-07-04"
    },
    {
      "approval_reason": "Official Tatoeba export with explicit sentence license; useful only as a small sentence-style supplement.",
      "approved": true,
      "attribution_requirements": "Keep source attribution to Tatoeba and preserve sentence IDs when retained in manifests.",
      "checksum_available": false,
      "checksum_url": null,
      "commercial_use_status": "allowed_with_attribution",
      "content_type": "parallel_and_single_sentences",
      "documented_retrieval_method": "Use official Tatoeba exports from https://tatoeba.org/en/downloads and filter to Turkish/English sentences only.",
      "estimated_download_size": "official export size varies by snapshot; sample cap is enforced before use",
      "estimated_download_size_bytes": 200000000,
      "evidence_urls": [
        "https://tatoeba.org/en/downloads",
        "https://tatoeba.org/en/terms_of_use"
      ],
      "intended_sample_size_characters": 3000000,
      "jurisdiction_warning": "User-contributed sentences require attribution review and duplicate filtering.",
      "language": "mixed_tr_en",
      "license_id": "CC-BY-2.0-FR",
      "max_download_bytes": 1073741824,
      "max_sample_characters": 4000000,
      "modification_status": "allowed_with_attribution",
      "notes": "Do not use audio, profile data, comments, or private metadata; keep only text sentence exports.",
      "official_domains": [
        "tatoeba.org",
        "downloads.tatoeba.org"
      ],
      "official_download_url": "https://downloads.tatoeba.org/exports/sentences.tar.bz2",
      "official_homepage": "https://tatoeba.org/",
      "official_license_url": "https://tatoeba.org/en/terms_of_use",
      "redistribution_requirements": "Redistribution must preserve CC BY attribution information and source references.",
      "retrieval_method": "direct_download",
      "risk_level": "medium",
      "snapshot_date": "2026-07-04",
      "source_id": "tatoeba_tr_en_sentences",
      "source_name": "Tatoeba official sentence exports",
      "source_version": "exports reviewed on 2026-07-04"
    },
    {
      "approval_reason": "Official Python documentation with explicit documentation license; useful for English technical prose and code-adjacent examples.",
      "approved": true,
      "attribution_requirements": "Preserve Python documentation attribution and source URL in manifests.",
      "checksum_available": false,
      "checksum_url": null,
      "commercial_use_status": "allowed_with_license_compliance",
      "content_type": "technical_documentation",
      "documented_retrieval_method": "Use official Python documentation pages or archives from https://docs.python.org/3/ for a pinned Python 3 version; record exact URLs and hashes before any future download.",
      "estimated_download_size": "selected text documentation archive expected below 100 MB",
      "estimated_download_size_bytes": 100000000,
      "evidence_urls": [
        "https://docs.python.org/3/",
        "https://docs.python.org/3/license.html"
      ],
      "intended_sample_size_characters": 6000000,
      "jurisdiction_warning": "Code examples and documentation have separate license notes; preserve both in manifests.",
      "language": "en",
      "license_id": "PSF-2.0-docs-and-0BSD-examples",
      "max_download_bytes": 250000000,
      "max_sample_characters": 8000000,
      "modification_status": "allowed_with_license_compliance",
      "notes": "Strip navigation chrome, generated indexes, and duplicated API pages before tokenizer use.",
      "official_domains": [
        "docs.python.org",
        "python.org"
      ],
      "official_download_url": null,
      "official_homepage": "https://docs.python.org/3/",
      "official_license_url": "https://docs.python.org/3/license.html",
      "redistribution_requirements": "Redistribution must preserve the PSF documentation license and any relevant example-code license notices.",
      "retrieval_method": "documented_manual_sample",
      "risk_level": "low",
      "snapshot_date": "2026-07-04",
      "source_id": "python_docs_en",
      "source_name": "Python documentation English",
      "source_version": "Python 3 docs snapshot pinned before retrieval"
    },
    {
      "approval_reason": "Official Python documentation translation hosted by docs.python.org; useful for Turkish technical prose.",
      "approved": true,
      "attribution_requirements": "Preserve Python documentation attribution and Turkish documentation source URL in manifests.",
      "checksum_available": false,
      "checksum_url": null,
      "commercial_use_status": "allowed_with_license_compliance",
      "content_type": "technical_documentation",
      "documented_retrieval_method": "Use official Turkish Python documentation pages from https://docs.python.org/tr/3/ for a pinned Python 3 version; record exact URLs and hashes before any future download.",
      "estimated_download_size": "selected Turkish documentation pages expected below 100 MB",
      "estimated_download_size_bytes": 100000000,
      "evidence_urls": [
        "https://docs.python.org/tr/3/",
        "https://docs.python.org/3/license.html"
      ],
      "intended_sample_size_characters": 6000000,
      "jurisdiction_warning": "Translation coverage can differ by version; pin exact pages and remove duplicate navigation.",
      "language": "tr",
      "license_id": "PSF-2.0-docs-and-0BSD-examples",
      "max_download_bytes": 250000000,
      "max_sample_characters": 8000000,
      "modification_status": "allowed_with_license_compliance",
      "notes": "Use only official docs.python.org Turkish pages; avoid unofficial mirrored translations.",
      "official_domains": [
        "docs.python.org",
        "python.org"
      ],
      "official_download_url": null,
      "official_homepage": "https://docs.python.org/tr/3/",
      "official_license_url": "https://docs.python.org/3/license.html",
      "redistribution_requirements": "Redistribution must preserve the PSF documentation license and any relevant example-code license notices.",
      "retrieval_method": "documented_manual_sample",
      "risk_level": "low",
      "snapshot_date": "2026-07-04",
      "source_id": "python_docs_tr",
      "source_name": "Python documentation Turkish",
      "source_version": "Python 3 Turkish docs snapshot pinned before retrieval"
    }
  ]
}
